Timestamp,Game Title,Description,Itch.io Link,Game Cover Image
8/5/2023 0:42:38,[ME][TA]L,"[ME][TA]L is a rhythm game revolving around, you guessed it, metal! But it's not like your average rhythm game, so be careful. c:<",https://penguinies.itch.io/metal,https://drive.google.com/open?id=1H4XX69bAz-1HZYwgaD05VNBX56CKqBTM
8/5/2023 0:42:38,LEAGUE,"Sometimes you just get unlucky in a game of League of Legends -Ian Le 2023"
8/5/2023 0:42:38,CRAB,"Boiling crab?"
8/5/2023 0:42:38,NGNL,"No game, no life 👾"
8/5/2023 0:42:38,MTV,"Hey guys, David here with another MTV CRIBS videoooo"
8/5/2023 0:42:38,666,"It doesn't mean the devil."
8/5/2023 0:42:38,TFT,"Invoker Ahri? GG"
8/5/2023 0:42:38,WINNABLE,"Winnable? Winnable."
8/5/2023 0:42:38,TEST THE CHARACTER LIMIT,"Mic test 1, 2, 3"
8/5/2023 0:42:38,JP,"日本語"